{
  "projects": [
    {
      "id": "project-1771729232885-vhgxije4s",
      "timestamp": "2026-02-22T03:00:32.885Z",
      "fields": {
        "projectTitle": "Blood Donation Drive",
        "projectDate": "January 16, 2024",
        "club": "Rotaract Club of Quezon City",
        "projectCategory": "International",
        "areaOfFocus": "Basic Education and Literacy"
      },
      "generated_article": "**Blood Donation Drive**\n\nThis remarkable initiative, organized by Rotaract Club of Quezon City on January 16, 2024, represents a significant step forward in Basic Education and Literacy. \n\nThe project falls under the International category, demonstrating our commitment to making a positive impact in our local area. Through collaborative efforts and dedicated planning, this initiative has brought together community members to address important needs and create lasting change.\n\nThe success of this project highlights the power of community engagement and the importance of organized efforts in creating meaningful social impact. By focusing on Basic Education and Literacy, this initiative serves as a model for future projects and demonstrates the value of sustained community involvement.\n\nThis project exemplifies how dedicated individuals and organizations can work together to create positive change, fostering stronger community bonds and addressing critical needs in our area."
    },
    {
      "id": "project-1771729264500-0wvnn3v5w",
      "timestamp": "2026-02-22T03:01:04.500Z",
      "fields": {
        "projectTitle": "Blood Donation Drive",
        "projectDate": "January 16, 2024",
        "club": "Rotaract Club of Quezon City",
        "projectCategory": "Community",
        "areaOfFocus": "Basic Education and Literacy"
      },
      "generated_article": "**Blood Donation Drive**\n\nThis remarkable initiative, organized by Rotaract Club of Quezon City on January 16, 2024, represents a significant step forward in Basic Education and Literacy. \n\nThe project falls under the Community category, demonstrating our commitment to making a positive impact in our local area. Through collaborative efforts and dedicated planning, this initiative has brought together community members to address important needs and create lasting change.\n\nThe success of this project highlights the power of community engagement and the importance of organized efforts in creating meaningful social impact. By focusing on Basic Education and Literacy, this initiative serves as a model for future projects and demonstrates the value of sustained community involvement.\n\nThis project exemplifies how dedicated individuals and organizations can work together to create positive change, fostering stronger community bonds and addressing critical needs in our area."
    },
    {
      "id": "project-1771734339250-7biefw12a",
      "timestamp": "2026-02-22T04:25:39.250Z",
      "fields": {
        "projectTitle": "Test",
        "projectDate": "Jan 4 2027",
        "club": "Stanley Hill",
        "projectCategory": "Vocational",
        "areaOfFocus": "Basic Education and Literacy"
      },
      "generated_article": "**Test**\n\nThis remarkable initiative, organized by Stanley Hill on Jan 4 2027, represents a significant step forward in Basic Education and Literacy. \n\nThe project falls under the Vocational category, demonstrating our commitment to making a positive impact in our local area. Through collaborative efforts and dedicated planning, this initiative has brought together community members to address important needs and create lasting change.\n\nThe success of this project highlights the power of community engagement and the importance of organized efforts in creating meaningful social impact. By focusing on Basic Education and Literacy, this initiative serves as a model for future projects and demonstrates the value of sustained community involvement.\n\nThis project exemplifies how dedicated individuals and organizations can work together to create positive change, fostering stronger community bonds and addressing critical needs in our area."
    },
    {
      "id": "project-1771734365938-3ewaz82nl",
      "timestamp": "2026-02-22T04:26:05.938Z",
      "fields": {
        "projectTitle": "Test",
        "projectDate": "Jan 4 2027",
        "club": "Stanley Hill",
        "projectCategory": "Community",
        "areaOfFocus": "Environment"
      },
      "generated_article": "**Test**\n\nThis remarkable initiative, organized by Stanley Hill on Jan 4 2027, represents a significant step forward in Environment. \n\nThe project falls under the Community category, demonstrating our commitment to making a positive impact in our local area. Through collaborative efforts and dedicated planning, this initiative has brought together community members to address important needs and create lasting change.\n\nThe success of this project highlights the power of community engagement and the importance of organized efforts in creating meaningful social impact. By focusing on Environment, this initiative serves as a model for future projects and demonstrates the value of sustained community involvement.\n\nThis project exemplifies how dedicated individuals and organizations can work together to create positive change, fostering stronger community bonds and addressing critical needs in our area."
    },
    {
      "id": "project-1771769005969-xws3vbkzq",
      "timestamp": "2026-02-22T14:03:25.969Z",
      "fields": {
        "projectTitle": "Test",
        "projectDate": "Jan 4 2027",
        "club": "Stanley Hill",
        "projectCategory": "Community",
        "areaOfFocus": "Basic Education and Literacy"
      },
      "generated_article": "**Test**\n\nThis remarkable initiative, organized by Stanley Hill on Jan 4 2027, represents a significant step forward in Basic Education and Literacy. \n\nThe project falls under the Community category, demonstrating our commitment to making a positive impact in our local area. Through collaborative efforts and dedicated planning, this initiative has brought together community members to address important needs and create lasting change.\n\nThe success of this project highlights the power of community engagement and the importance of organized efforts in creating meaningful social impact. By focusing on Basic Education and Literacy, this initiative serves as a model for future projects and demonstrates the value of sustained community involvement.\n\nThis project exemplifies how dedicated individuals and organizations can work together to create positive change, fostering stronger community bonds and addressing critical needs in our area."
    },
    {
      "id": "project-1771770518357-ysogecj5q",
      "timestamp": "2026-02-22T14:28:38.357Z",
      "fields": {
        "projectTitle": "Test",
        "projectDate": "Jan 4 2027",
        "club": "Stanley Hill",
        "projectCategory": "International",
        "areaOfFocus": "Environment"
      },
      "generated_article": "**Test**\n\nThis remarkable initiative, organized by Stanley Hill on Jan 4 2027, represents a significant step forward in Environment. \n\nThe project falls under the International category, demonstrating our commitment to making a positive impact in our local area. Through collaborative efforts and dedicated planning, this initiative has brought together community members to address important needs and create lasting change.\n\nThe success of this project highlights the power of community engagement and the importance of organized efforts in creating meaningful social impact. By focusing on Environment, this initiative serves as a model for future projects and demonstrates the value of sustained community involvement.\n\nThis project exemplifies how dedicated individuals and organizations can work together to create positive change, fostering stronger community bonds and addressing critical needs in our area."
    },
    {
      "id": "project-1771771860771-5h8tqsp9i",
      "timestamp": "2026-02-22T14:51:00.771Z",
      "fields": {
        "projectTitle": "Test",
        "projectDate": "Jan 4 2027",
        "club": "Stanley Hill",
        "projectCategory": "Vocational",
        "areaOfFocus": "Basic Education and Literacy"
      },
      "generated_article": "**Test**\n\nThis remarkable initiative, organized by Stanley Hill on Jan 4 2027, represents a significant step forward in Basic Education and Literacy. \n\nThe project falls under the Vocational category, demonstrating our commitment to making a positive impact in our local area. Through collaborative efforts and dedicated planning, this initiative has brought together community members to address important needs and create lasting change.\n\nThe success of this project highlights the power of community engagement and the importance of organized efforts in creating meaningful social impact. By focusing on Basic Education and Literacy, this initiative serves as a model for future projects and demonstrates the value of sustained community involvement.\n\nThis project exemplifies how dedicated individuals and organizations can work together to create positive change, fostering stronger community bonds and addressing critical needs in our area."
    },
    {
      "id": "project-1771771878125-kspv9whgo",
      "timestamp": "2026-02-22T14:51:18.125Z",
      "fields": {
        "projectTitle": "Test",
        "projectDate": "Jan 4 2027",
        "club": "Stanley Hill",
        "projectCategory": "Vocational",
        "areaOfFocus": "Basic Education and Literacy"
      },
      "generated_article": "**Test**\n\nThis remarkable initiative, organized by Stanley Hill on Jan 4 2027, represents a significant step forward in Basic Education and Literacy. \n\nThe project falls under the Vocational category, demonstrating our commitment to making a positive impact in our local area. Through collaborative efforts and dedicated planning, this initiative has brought together community members to address important needs and create lasting change.\n\nThe success of this project highlights the power of community engagement and the importance of organized efforts in creating meaningful social impact. By focusing on Basic Education and Literacy, this initiative serves as a model for future projects and demonstrates the value of sustained community involvement.\n\nThis project exemplifies how dedicated individuals and organizations can work together to create positive change, fostering stronger community bonds and addressing critical needs in our area."
    }
  ]
}